{
  "$schema": "https://json-schema.org/draft/2020-12/schema",
  "title": "LensTemper Review Output",
  "type": "object",
  "required": [
    "schema_version",
    "record_id",
    "pass_id",
    "target_path",
    "target_revision",
    "template_revision",
    "lens",
    "lens_revision",
    "attempt",
    "run_mode",
    "execution_mode",
    "status",
    "artifact_path",
    "provenance",
    "verdict",
    "material_blockers",
    "cross_cutting_status",
    "scorecard"
  ],
  "properties": {
    "schema_version": { "const": 2 },
    "fixture_kind": { "type": "string" },
    "record_id": { "type": "string" },
    "pass_id": { "type": "string" },
    "target_path": { "type": "string" },
    "target_revision": { "type": "string" },
    "review_input_revision": { "type": "string" },
    "template_revision": { "type": "string" },
    "lens": { "type": "string" },
    "lens_revision": { "type": "string" },
    "attempt": { "type": "integer", "minimum": 1 },
    "run_mode": {
      "enum": ["full", "inline", "advisory"]
    },
    "execution_mode": {
      "enum": ["fresh_spawned_lens_reviewers", "fresh_spawned_orchestrator", "manual_or_imported"]
    },
    "status": {
      "enum": ["completed", "error", "superseded", "stale"]
    },
    "agent_id": { "type": "string" },
    "closed": { "type": "boolean" },
    "output_captured": { "type": "boolean" },
    "artifact_path": { "type": "string" },
    "markdown_artifact_path": { "type": "string" },
    "markdown_artifact_sha": { "type": "string" },
    "provenance": {
      "type": "object",
      "required": ["input_sources"],
      "properties": {
        "input_sources": {
          "type": "array",
          "items": {
            "type": "object",
            "required": ["role", "basis", "paths_reviewed", "target_included"],
            "properties": {
              "role": { "type": "string" },
              "basis": {
                "enum": ["direct_workspace_read", "provided_packet", "imported_archive", "fixture"]
              },
              "paths_reviewed": {
                "type": "array",
                "items": { "type": "string" },
                "description": "Repository-relative files this source read from the workspace. direct_workspace_read needs at least one existing path, including target_path when target_included is true on a completed review; every other basis, including provided_packet, keeps it empty."
              },
              "target_included": { "type": "boolean" }
            },
            "additionalProperties": true
          }
        }
      },
      "additionalProperties": true
    },
    "verdict": {
      "enum": ["Strong", "Usable with fixes", "High risk", "Incomplete"]
    },
    "blocking": {
      "description": "Lens verdict: yes when the lens raised a [critical] or [major] finding. Must agree with material_blockers.present.",
      "enum": ["yes", "no"]
    },
    "goal_fit": {
      "description": "Lens verdict: ok when the plan can meet its goal as written, at_risk when an unaddressed gap could make a goal fail, violated when the plan works against a stated goal or non-goal. Not ok when blocking is yes.",
      "enum": ["ok", "at_risk", "violated"]
    },
    "material_blockers": {
      "type": "object",
      "required": ["present", "summary", "count"],
      "properties": {
        "present": { "type": "boolean" },
        "summary": { "type": "string", "minLength": 1 },
        "count": { "type": "integer", "minimum": 0 }
      },
      "additionalProperties": true
    },
    "cross_cutting_status": {
      "type": "object",
      "required": [
        "security_privacy",
        "accessibility",
        "performance",
        "reliability_rollback",
        "observability_debuggability",
        "compatibility_platform"
      ],
      "properties": {
        "security_privacy": { "enum": ["not_applicable", "non_blocking", "material_issue"] },
        "accessibility": { "enum": ["not_applicable", "non_blocking", "material_issue"] },
        "performance": { "enum": ["not_applicable", "non_blocking", "material_issue"] },
        "reliability_rollback": { "enum": ["not_applicable", "non_blocking", "material_issue"] },
        "observability_debuggability": { "enum": ["not_applicable", "non_blocking", "material_issue"] },
        "compatibility_platform": { "enum": ["not_applicable", "non_blocking", "material_issue"] }
      },
      "additionalProperties": true
    },
    "scorecard": {
      "type": "object",
      "required": [
        "correctness",
        "completeness",
        "risk_awareness",
        "testability",
        "maintainability",
        "ship_readiness"
      ],
      "properties": {
        "correctness": { "type": "integer", "minimum": 1, "maximum": 5 },
        "completeness": { "type": "integer", "minimum": 1, "maximum": 5 },
        "risk_awareness": { "type": "integer", "minimum": 1, "maximum": 5 },
        "testability": { "type": "integer", "minimum": 1, "maximum": 5 },
        "maintainability": { "type": "integer", "minimum": 1, "maximum": 5 },
        "ship_readiness": { "type": "integer", "minimum": 1, "maximum": 5 }
      },
      "additionalProperties": true
    },
    "score_challenges": {
      "type": "object",
      "additionalProperties": {
        "type": "object",
        "required": [
          "would_make_this_a_4",
          "why_not_present",
          "evidence_no_material_issue"
        ],
        "properties": {
          "would_make_this_a_4": { "type": "string", "minLength": 1 },
          "why_not_present": { "type": "string", "minLength": 1 },
          "evidence_no_material_issue": { "type": "string", "minLength": 1 }
        },
        "additionalProperties": true
      }
    }
  },
  "allOf": [
    {
      "if": { "properties": { "run_mode": { "const": "full" } } },
      "then": {
        "required": ["review_input_revision"]
      }
    },
    {
      "if": { "properties": { "status": { "const": "completed" } } },
      "then": {
        "required": ["markdown_artifact_path", "markdown_artifact_sha"]
      }
    }
  ],
  "additionalProperties": true
}
