{
  "schema_version": 2,
  "record_id": "review-duplicate-b",
  "pass_id": "example-pass",
  "target_path": "reviews/examples/artifacts/target.valid.md",
  "target_revision": "git:73eaed921475be235f6684abdd2ce19a4e367c7f",
  "template_revision": "example-template-revision",
  "lens": "implementation",
  "lens_revision": "example-lens-revision",
  "attempt": 1,
  "execution_mode": "fresh_spawned_lens_reviewers",
  "status": "completed",
  "agent_id": "agent-example-duplicate-b",
  "closed": true,
  "output_captured": true,
  "artifact_path": "reviews/examples/support/review-duplicate-b.json",
  "markdown_artifact_path": "reviews/examples/artifacts/review-output.valid-full.md",
  "markdown_artifact_sha": "git:36c6af9ab4802ca232f78175c51e4a5335c4392f",
  "verdict": "Strong",
  "material_blockers": {
    "present": false,
    "summary": "duplicate attempt fixture",
    "count": 0
  },
  "cross_cutting_status": {
    "security_privacy": "not_applicable",
    "accessibility": "not_applicable",
    "performance": "not_applicable",
    "reliability_rollback": "not_applicable",
    "observability_debuggability": "not_applicable",
    "compatibility_platform": "not_applicable"
  },
  "scorecard": {
    "correctness": 5,
    "completeness": 5,
    "risk_awareness": 5,
    "testability": 5,
    "maintainability": 5,
    "ship_readiness": 5
  },
  "run_mode": "full",
  "provenance": {
    "input_sources": [
      {
        "role": "target",
        "basis": "direct_workspace_read",
        "paths_reviewed": [
          "reviews/examples/artifacts/target.valid.md"
        ],
        "target_included": true
      }
    ]
  },
  "score_challenges": {
    "correctness": {
      "would_make_this_a_4": "A material correctness issue would lower this score.",
      "why_not_present": "No material correctness issue is present in this fixture.",
      "evidence_no_material_issue": "Fixture evidence records no accepted material blocker for correctness."
    },
    "completeness": {
      "would_make_this_a_4": "A material completeness issue would lower this score.",
      "why_not_present": "No material completeness issue is present in this fixture.",
      "evidence_no_material_issue": "Fixture evidence records no accepted material blocker for completeness."
    },
    "risk_awareness": {
      "would_make_this_a_4": "A material risk_awareness issue would lower this score.",
      "why_not_present": "No material risk_awareness issue is present in this fixture.",
      "evidence_no_material_issue": "Fixture evidence records no accepted material blocker for risk_awareness."
    },
    "testability": {
      "would_make_this_a_4": "A material testability issue would lower this score.",
      "why_not_present": "No material testability issue is present in this fixture.",
      "evidence_no_material_issue": "Fixture evidence records no accepted material blocker for testability."
    },
    "maintainability": {
      "would_make_this_a_4": "A material maintainability issue would lower this score.",
      "why_not_present": "No material maintainability issue is present in this fixture.",
      "evidence_no_material_issue": "Fixture evidence records no accepted material blocker for maintainability."
    },
    "ship_readiness": {
      "would_make_this_a_4": "A material ship_readiness issue would lower this score.",
      "why_not_present": "No material ship_readiness issue is present in this fixture.",
      "evidence_no_material_issue": "Fixture evidence records no accepted material blocker for ship_readiness."
    }
  },
  "review_input_revision": "sha256:dc29a2b9712d8555b2b607998bd97d25cc3a61dbc0e447dd8dee1865a6c3833d"
}
